{
  "$schema": "../../../schema/portable.schema.json",
  "name": "route-single-param",
  "description": "A :name segment must be extracted into params.",
  "function": "match_path",
  "priority": "P0",
  "input": { "pattern": "/users/:id", "path": "/users/42" },
  "expected": { "matched": true, "params": { "id": "42" } }
}
