{
  "$schema": "../../../schema/portable.schema.json",
  "name": "session-ttl-expired",
  "description": "A TTL tick after the expiry deadline returns ExpireSession.",
  "function": "session_step",
  "priority": "P0",
  "input": {
    "state": { "policy": "kick-old" },
    "event": { "kind": "ttl_tick", "suspended_at_ms": 1000, "now_ms": 2001, "ttl_ms": 1000 }
  },
  "expected": { "kind": "expire_session" }
}
