{
  "$schema": "../../../schema/portable.schema.json",
  "name": "route-exact-match",
  "description": "Exact pattern with no params or wildcards.",
  "function": "match_path",
  "priority": "P0",
  "input": { "pattern": "/dashboard", "path": "/dashboard" },
  "expected": { "matched": true, "params": {} }
}
